{
  "$schema": "https://json-schema.org/draft/2020-12/schema",
  "$id": "adversarial-review.schema.json",
  "title": "Knowledge Compiler Adversarial Review 4.3",
  "type": "object",
  "required": [
    "claim_id",
    "evidence_id",
    "relation",
    "reviewer_id",
    "independence",
    "evidence_fragment",
    "strongest_counter_reading",
    "what_would_falsify"
  ],
  "additionalProperties": false,
  "properties": {
    "claim_id": {
      "type": "string",
      "minLength": 1
    },
    "evidence_id": {
      "type": "string",
      "minLength": 1
    },
    "relation": {
      "enum": [
        "ENTAILS",
        "CONTRADICTS",
        "PARTIAL",
        "UNRELATED",
        "AMBIGUOUS"
      ]
    },
    "reviewer_id": {
      "type": "string",
      "minLength": 1,
      "description": "Stable identifier of the reviewer, normally a model id. Must differ from the first-pass reviewer_id."
    },
    "independence": {
      "enum": [
        "SAME_CONTEXT",
        "SAME_MODEL",
        "SAME_FAMILY",
        "CROSS_FAMILY"
      ],
      "description": "How independent this reading actually was. SAME_CONTEXT is never accepted. SAME_MODEL means the same model in a fresh context that was not shown the first conclusion. A tier may be under-claimed but never over-claimed: the runtime derives a ceiling from the two reviewer ids."
    },
    "evidence_fragment": {
      "type": "string",
      "minLength": 1,
      "description": "Must appear literally in the evidence source_text."
    },
    "strongest_counter_reading": {
      "type": "string",
      "minLength": 1,
      "description": "The strongest alternative reading of this evidence, stated even when the reviewer agrees with the first pass."
    },
    "what_would_falsify": {
      "type": "string",
      "minLength": 1,
      "description": "A concrete observation that would overturn this reading. Written for a human to check without trusting either model."
    }
  }
}
