[
  {
    "claim_id": "AI-COT-001",
    "evidence_id": "E-AI-COT-001-1",
    "relation": "PARTIAL",
    "reviewer_id": "claude-haiku-4-5-20251001",
    "independence": "SAME_FAMILY",
    "evidence_fragment": "we show that LLMs are decent zero-shot reasoners by simply adding \"Let's think step by step\" before each answer. Experimental results demonstrate that our Zero-shot-CoT, using the same single prompt template, significantly outperforms zero-shot LLM performances on diverse benchmark reasoning tasks including arithmetics (MultiArith, GSM8K, AQUA-RAT, SVAMP), symbolic reasoning (Last Letter, Coin Flip)",
    "strongest_counter_reading": "The evidence tests only two specific models (InstructGPT/text-davinci-002 and 540B PaLM), demonstrating the technique works for these instances. The claim asserts the effect holds for 'any' large language model—a universal statement that requires broader evidence across model families, architectures, sizes, and training approaches to fully support. The evidence shows the effect exists but does not establish it is universal.",
    "what_would_falsify": "Test the 'Let's think step by step' prompt on a diverse set of large language models (different architectures, sizes, training objectives) and find that a significant proportion fail to show improvement on arithmetic and symbolic reasoning tasks, or show negligible or inconsistent improvements."
  }
]
