[
  {
    "claim_id": "AI-COT-004",
    "evidence_id": "E-AI-COT-004-1",
    "relation": "ENTAILS",
    "reviewer_id": "claude-haiku-4-5-20251001",
    "independence": "SAME_FAMILY",
    "evidence_fragment": "such reasoning abilities emerge naturally in sufficiently large language models via a simple method called chain of thought prompting",
    "strongest_counter_reading": "The evidence demonstrates that chain of thought works on the three tested large language models, but does not establish a clear threshold or prove that it fails on smaller models. The phrase 'sufficiently large' could be interpreted as merely descriptive of the models tested rather than establishing a size requirement.",
    "what_would_falsify": "Empirical demonstration that chain of thought prompting produces comparable reasoning improvements on small language models (e.g., models with under 10 billion parameters) compared to the improvements shown on large models."
  }
]
