[
  {
    "claim_id": "AI-RAG-001",
    "evidence_id": "E-AI-RAG-001-1",
    "relation": "CONTRADICTS",
    "reviewer_id": "claude-haiku-4-5-20251001",
    "independence": "SAME_FAMILY",
    "evidence_fragment": "LLMs are susceptible to adopting incorrect retrieved content, overriding their own correct prior knowledge over 60% of the time.",
    "strongest_counter_reading": "The evidence opens by noting RAG is 'frequently used to mitigate hallucinations,' which could be read as supporting the idea that RAG helps with hallucinations generally. One might argue the evidence only describes a specific failure mode rather than refuting RAG's overall effectiveness.",
    "what_would_falsify": "Empirical results showing that RAG systems with high-quality retrieval (e.g., >95% retrieval accuracy) achieve near-zero hallucination rates compared to baseline LLMs, or longitudinal data from production RAG systems demonstrating hallucination elimination in practice."
  }
]
